Index,Article Title,Authors,Publication Year,Answer,Analysis
1,Feedstocks for Lignocellulosic Biofuels,Somerville et al.,2010,yes,"the abstract discusses the production of biofuels and the implications of using food crops for fuel, highlighting the competition for land resources. it addresses the potential of lignocellulosic biomass as a more sustainable alternative for bioenergy, which aligns with the principles of ecosystem service replacement in biotechnology. the exploration of plants suitable for bioenergy crops could contribute to enhancing ecosystem services by reducing land competition and improving sustainability."
4,Finding pathways to national-scale land-sector sustainability,Gao et al.,2017,yes,"the abstract discusses the assessment of the feasibility of achieving multiple sustainable development goals (sdgs) at the national scale, specifically in the australian land sector. it emphasizes the importance of effective science-driven targets and the need for integrated analyses across various sectors, which aligns with the principles of biotechnological ecosystem service replacement research. the focus on land-use dynamics, sustainability outcomes, and the interplay between different sectors suggests that the findings could inform strategies for enhancing ecosystem services through biotechnological interventions."
5,Anatomy and resilience of the global production ecosystem,Nystrom et al.,2019,yes,"the abstract discusses the transformation of the earth's biosphere due to human activities, particularly in the context of biomass production for food, fuel, and fiber. it highlights the consequences of system simplification and intensification, which could be relevant to biotechnological ecosystem service replacement research. the focus on sustainability, financial redirection, and the role of various stakeholders suggests a connection to the need for innovative biotechnological solutions to address emerging risks and enhance ecosystem services."
6,How agro-ecological research helps to address food security issues under new IPM and pesticide reduction policies for global crop production systems,Birch et al.,2011,yes,"the abstract discusses critical issues related to food security and crop protection, emphasizing the role of integrated pest management (ipm) in addressing food losses caused by pests. it highlights the importance of ecological services, particularly biocontrol, in sustainable agricultural practices. the focus on multi-disciplinary research and the integration of various ipm technologies aligns well with the theme of biotechnological ecosystem service replacement, making it a suitable article for this area of research."
7,The importance of grasslands for animal production and other functions: a review on management and methodological progress in the tropics,Boval et al.,2012,yes,"the abstract discusses the critical role of grasslands in providing various ecosystem services, particularly in tropical developing countries. it highlights the challenges of balancing livestock production with the preservation of these services, which is relevant to biotechnological ecosystem service replacement research. the mention of emerging technologies for improving management and productivity in grassland systems aligns well with the goals of enhancing ecosystem services through biotechnological approaches."
8,Reconciling productivity with protection of the environment: Is temperate agroforestry the answer?,Smith et al.,2013,yes,"the abstract discusses agroforestry as a multifunctional land-use system that integrates trees and shrubs with crops and livestock, highlighting its potential to provide both commodity and non-commodity outputs. it emphasizes the role of agroforestry in enhancing ecosystem services, such as biodiversity protection and climate resilience, which aligns well with biotechnological ecosystem service replacement research. the focus on mitigating negative agricultural impacts through sustainable practices further supports its relevance to the field."
9,The rumen: a unique source of enzymes for enhancing livestock production.,Selinger et al.,1996,yes,"the abstract discusses the use of enzyme supplementation in livestock diets to improve feed efficiency and growth rates, which aligns with biotechnological approaches to enhance ecosystem services in agriculture. it highlights the role of recombinant dna technology in developing more effective enzyme sources, which can contribute to sustainable livestock production and potentially reduce environmental impacts. this focus on biotechnology and its applications in livestock production makes it relevant to research on biotechnological ecosystem service replacement."
10,Organic agriculture and ecosystem services,Sandhu et al.,2010,yes,"the abstract discusses the importance of ecosystem services (es) in agriculture, highlighting their role in food security and the potential for eco-technologies to enhance these services. it emphasizes the economic and ecological benefits of es, particularly in the context of organic agriculture, which aligns well with biotechnological ecosystem service replacement research. the focus on redesigning small-scale farms using ecological knowledge suggests a direct connection to biotechnological innovations aimed at improving ecosystem service provision."
11,Predictive model for sustaining biodiversity in tropical countryside,Mendenhall et al.,2011,yes,"the abstract discusses the impact of agricultural land use on biodiversity, specifically focusing on how farmland can support native bird species through the preservation of fine-scale ecosystem elements. this aligns well with biotechnological ecosystem service replacement research, as it explores the trade-offs between agricultural production and biodiversity conservation. the findings suggest practical applications for managing ecosystems within agricultural landscapes, which is crucial for enhancing ecosystem services in biotechnological contexts."
12,Soil science and the carbon civilization,Lal et al.,2007,yes,"the abstract discusses the critical role of soil science in addressing various societal needs, including food security, environmental sustainability, and urban ecosystem management. it emphasizes the importance of interdisciplinary collaboration, including the integration of biotechnology, to enhance ecosystem services and meet the demands of a growing population. this aligns well with biotechnological ecosystem service replacement research, as it highlights the potential of biotechnological innovations in sustainable soil management and the provision of ecosystem services."
13,Assessment of multiple ecosystem services in New Zealand at the catchment scale,Ausseil et al.,2013,yes,"the abstract discusses the development of spatially explicit models for assessing various ecosystem services, such as climate regulation, soil erosion control, and water quality. these models are designed to evaluate land-use scenarios, which is relevant for biotechnological ecosystem service replacement research. the focus on sustainability and the application of these models to real-world scenarios, like afforestation in new zealand, aligns well with the goals of understanding and potentially replacing ecosystem services through biotechnological means."
14,Key ecosystem services and ecological intensification of agriculture in the tropical high-Andean Puna as affected by land-use and climate changes,Rolando et al.,2017,yes,"the abstract discusses the impact of agricultural practices on ecosystem services in high-altitude ecosystems, specifically in the high-andean puna. it highlights the importance of biodiversity, soil organic carbon, and water provision, which are crucial for ecosystem sustainability. the proposed technologies and practices for preserving or restoring ecosystem services align well with the goals of biotechnological ecosystem service replacement research, making it a suitable article for this field."
15,"Direct and indirect effects of microplastics on bivalves, with a focus on edible species: A mini-review",Zhang et al.,2020,yes,"the abstract highlights the crucial role of bivalves in ecosystems and their decline due to multiple stressors, particularly microplastics. it addresses the implications for ecosystem services and human health, which are significant concerns in biotechnological ecosystem service replacement research. the exploration of microplastics’ impacts on bivalves, a vital source of food and industry, aligns with the objectives of understanding and potentially replacing ecosystem services affected by environmental contaminants."
18,Biotechnological Advances for Restoring Degraded Land for Sustainable Development,Tripathi et al.,2017,yes,"the abstract discusses the urgent need to restore degraded land due to pollution and unsustainable practices, emphasizing the importance of ecosystem services like biodiversity and nutrient cycling. it highlights bioremediation as a promising technology, while also noting its limitations. the mention of recent biotechnological advancements, such as efficient microbial consortia and enzyme applications, indicates a focus on innovative solutions for ecosystem service restoration. this aligns well with biotechnological ecosystem service replacement research, making the article suitable for that field."
19,Scenarios for Australian agricultural production and land use to 2050,Grundy et al.,2016,yes,"the abstract discusses the evolution of australian agricultural land use in response to various economic and environmental factors, including climate change and greenhouse gas policies. it highlights the competition between traditional agricultural production and new land uses like carbon plantings and biofuels, which is relevant to biotechnological ecosystem service replacement research. the findings suggest that agricultural production can coexist with non-food land uses, indicating potential for biotechnological innovations to enhance productivity and sustainability in agriculture while addressing ecosystem service needs."
21,Multifunctional landscapes: Site characterization and field-scale design to incorporate biomass production into an agricultural system,Ssegane et al.,2015,yes,"the abstract discusses the integration of bioenergy crops into land management to enhance ecosystem services while addressing food production needs. it emphasizes sustainable practices such as nutrient recovery and phytoremediation, which are relevant to biotechnological ecosystem service replacement research. the focus on minimizing environmental impacts and improving land use aligns well with the goals of this field."
22,Transparent thermoplastic polyurethane air filters for efficient electrostatic capture of particulate matter pollutants,Chen et al.,2019,yes,"the abstract discusses the development of electrospun thermoplastic polyurethane (tpu) nanofibers for air filtration, focusing on their effectiveness in removing particulate matter (pm) air pollution. this research is relevant to biotechnological ecosystem service replacement as it addresses a critical public health issue linked to environmental quality. the innovative approach and promising results suggest potential applications in improving air quality, which aligns with the goals of ecosystem service replacement."
24,Revolutionary Land Use Change in the 21st Century: Is (Rangeland) Science Relevant?,Herrick et al.,2012,yes,"the abstract discusses the need for innovative management systems in land use, particularly in the context of increasing food, fiber, and fuel demands. it emphasizes the importance of understanding ecosystem services and the consequences of land conversion, which aligns well with biotechnological ecosystem service replacement research. the proposed strategies for enhancing rangeland science relevance also suggest a focus on empirical studies and modeling that could directly inform biotechnological applications in ecosystem management."
26,A decision-support system for forest density management within upland black spruce stand-types,Newton et al.,2012,yes,"the abstract describes a study focused on developing a structural stand density management model for black spruce in the canadian boreal forest, which includes metrics related to productivity, biomass, carbon sequestration, and economic values of forest products. this aligns with biotechnological ecosystem service replacement research as it emphasizes sustainable forest management, carbon credits, and the production of high-value end-products, all of which are relevant to enhancing ecosystem services through biotechnological approaches."
27,Switching to nanonutrients for sustaining agroecosystems and environment: the challenges and benefits in moving up from ionic to particle feeding,Bhardwaj et al.,2022,yes,"the abstract discusses the increasing pressure on agriculture to meet food demands while addressing the negative impacts of traditional fertilizers on the environment. it highlights nanotechnology as a potential sustainable alternative, particularly through nanofertilizers, which could enhance nutrient efficiency and reduce environmental degradation. the focus on both the benefits and challenges of nanofertilizers suggests a thorough examination of their role in ecosystem services, making it suitable for biotechnological ecosystem service replacement research."
28,Regenerative agriculture and integrative permaculture for sustainable and technology driven global food production and security,McLennon et al.,2021,yes,"the abstract discusses the challenges of sustainable food production in the context of a growing global population and the adverse impacts of conventional agricultural practices. it emphasizes the importance of regenerative agriculture and permaculture as holistic approaches that can enhance ecosystem services while reducing reliance on external inputs. this aligns well with biotechnological ecosystem service replacement research, as it explores innovative agricultural practices and technologies aimed at improving sustainability and ecosystem health."
29,Energy recovery from grass of urban roadside verges by anaerobic digestion and combustion after pre-processing,Piepenschneider et al.,2016,yes,"the abstract discusses the potential of urban roadside verges for bioenergy recovery, focusing on two techniques: anaerobic digestion and the ifbb procedure. it highlights the biomass yield, methane production, and energy output from different management strategies. the research indicates that modifying management practices can enhance energy recovery and improve ecosystem services, such as biodiversity. this aligns well with biotechnological ecosystem service replacement research, as it explores sustainable resource utilization and ecological benefits."
34,Farming strategies to fuel bioenergy demands and facilitate essential soil services,Franzluebbers et al.,2015,yes,"the abstract discusses the role of perennial lignocellulosic biomass and crop residues in agricultural systems, emphasizing their importance for soil health, water conservation, and as biofuel feedstocks. it highlights the competing demands for these resources and the potential environmental and economic consequences of their use. this aligns well with biotechnological ecosystem service replacement research, as it addresses the balance between biomass utilization for bioenergy and maintaining ecosystem services essential for sustainable agriculture. the focus on scientific evidence and policy implications further supports its relevance to the field."
37,Estimating pasture quality of Mediterranean grasslands using hyperspectral narrow bands from field spectroscopy by Random Forest and PLS regressions,Fernandez-Habas et al.,2022,yes,"the abstract discusses the use of hyperspectral imaging to assess pasture quality in mediterranean grasslands, which is directly related to ecosystem services. it highlights the importance of managing these grasslands for sustainable ecosystem service provision, making it relevant for research on biotechnological ecosystem service replacement. the focus on remote sensing and machine learning methods to improve pasture management aligns well with the goals of enhancing ecosystem services through innovative technologies."
38,Assessing influence in biofuel production and ecosystem services when environmental changes affect plant-pest relationships,De Simone et al.,2020,yes,"the abstract discusses the impact of climate change on biodiversity and agricultural services, specifically focusing on jatropha curcas as a biodiesel crop and its interaction with pests. it highlights the economic losses associated with this interaction and introduces a new index to assess suitable cultivation areas. this aligns well with biotechnological ecosystem service replacement research, as it addresses the sustainability of biofuels and the ecological dynamics affecting agricultural productivity in the context of climate change."
39,"Effectiveness of water-saving technologies during early stages of restoration of endemic Opuntia cacti in the Galapagos Islands, Ecuador",Tapia et al.,2019,yes,"the article focuses on the restoration of keystone species, specifically the opuntia spp. cacti in the galapagos archipelago, which are crucial for supporting unique vertebrate communities in arid ecosystems. it evaluates the effectiveness of water-saving technologies in enhancing the survival and growth of these cacti, which aligns well with biotechnological approaches to ecosystem service replacement. the findings suggest that innovative technologies can improve restoration outcomes, making it relevant to the field of biotechnological ecosystem service research."
40,"Microplastics incorporated by honeybees from food are transferred to honey, wax and larvae",Alma et al.,2023,yes,"the abstract discusses the impact of microplastics on honeybees, which are crucial for ecosystem services such as pollination. it highlights how microplastics can be ingested by bees and potentially enter the food chain, raising concerns about their effects on both bee populations and human health. this aligns with biotechnological ecosystem service replacement research, as understanding the implications of microplastics on key species like honeybees is essential for developing strategies to mitigate their impact on ecosystems. the study's findings contribute valuable insights into the dynamics of microplastics in terrestrial environments and their broader ecological implications."
42,Grass silage pulp as a dietary component for high-yielding dairy cows,Savonen et al.,2020,yes,"the abstract discusses the use of green biorefineries to efficiently utilize grassland biomass, highlighting the potential of fractionated grass silage as a feed source for dairy cows. it examines the effects of incorporating a solid fraction (pulp) into the cows' diet and its impact on feed intake, fermentation, digestion, and milk production. this aligns well with biotechnological ecosystem service replacement research, as it explores innovative approaches to enhance the utilization of ecosystem services from grasslands while addressing sustainability in livestock feeding practices."
43,An LCA impact assessment model linking land occupation and malnutrition-related DALYs,Ridoutt et al.,2019,yes,"the abstract discusses a model that assesses the impacts of land occupation on food production and human health, specifically linking it to malnutrition-related disability-adjusted life years (dalys). this focus on land use and its consequences on ecosystem services, particularly in the context of food production, aligns well with biotechnological ecosystem service replacement research. the model's ability to evaluate trade-offs between land use, water consumption, and health impacts further supports its relevance to the field."
44,Sustainable Development of China's Rare Earth Industry within and without the WTO,Gavin et al.,2015,yes,"the abstract discusses the environmental impacts of china's rare earth mineral production and the need for sustainable development in this sector. it emphasizes the importance of integrating economic development with conservation efforts, which aligns well with biotechnological ecosystem service replacement research. the focus on resource efficiency, environmental technologies, and the valuation of natural capital suggests that the article could provide valuable insights into how biotechnology can contribute to sustainable practices in the rare earth industry."
46,Forest Bioeconomy in Brazil: Potential Innovative Products from the Forest Sector,Maximo et al.,2022,yes,"the abstract discusses the role of the forest sector in the circular bioeconomy, emphasizing the development of renewable materials and ecosystem services. it highlights innovations in wood-based products and the integration of the pulp and paper industry with biorefineries, which aligns well with research on biotechnological ecosystem service replacement. the focus on sustainability and the potential for diversification in the brazilian forest industry further supports its relevance to this field of study."
47,Optimizing pollinator conservation and crop yield among perennial bioenergy crops,Kemmerling et al.,2021,yes,"the abstract discusses the transition of agricultural landscapes to diversified systems that enhance biodiversity while producing biofuels. it specifically examines the trade-offs between different perennial biofuel crops and their impacts on biodiversity and crop yield. this aligns well with biotechnological ecosystem service replacement research, as it explores how agricultural practices can be optimized to support both biodiversity and biofuel production, highlighting the multifunctionality of these systems. the findings suggest a need for policies that support sustainable markets, which is crucial for ecosystem service enhancement in agricultural landscapes."
48,Wildflower mixtures for bioethanol production - Pretreatment and enzymatic hydrolysis,Heller et al.,2020,yes,"the abstract discusses the potential of wildflower biomass for bioethanol production, highlighting its ecological benefits and the optimization of enzymatic hydrolysis processes. this aligns well with biotechnological ecosystem service replacement research, as it explores sustainable energy solutions while considering biodiversity and ecosystem functions. the findings suggest that wildflowers could serve as a viable alternative to traditional biomass sources, contributing to both renewable energy and ecological health."
50,Progress on breeding and food processing efforts to improve chemical composition and functionality of intermediate wheatgrass (Thinopyrum intermedium) for the food industry,Bharathi et al.,2022,yes,"the abstract discusses the potential of thinopyrum intermedium (intermediate wheatgrass) as a novel food crop, emphasizing its perennial growth habit and the ecosystem services it provides. it highlights how breeding and processing strategies can enhance its chemical composition and functionality, making it competitive with annual cereals. this aligns well with biotechnological ecosystem service replacement research, as it explores the environmental benefits and sustainable agricultural practices associated with perennial crops."
51,"Solid Fuel Generation from Urban Leaf Litter in Mixture with Grass Cuttings: Chemical Composition, Energetic Characteristics, and Impact of Preprocessing",Piepenschneider et al.,2016,yes,"the abstract discusses the potential of urban biomass from green areas for bioenergy recovery, which aligns with biotechnological ecosystem service replacement research. it evaluates the effects of a specific biomass treatment method (ifbb) on the energy characteristics of different organic materials. the findings related to methane yields and the need for models to assess the economic and ecological potential of urban biomass support its relevance to the field."
53,"Enset farming system - a resilient, climate-robust production system in South and South-Western Ethiopia",Senbeta et al.,2022,yes,"the abstract discusses the enset farming system in ethiopia, highlighting its ecosystem services and resilience in the face of global changes, which are relevant topics in biotechnological ecosystem service replacement research. it examines the sustainability of enset compared to cereals and cash crops, making it suitable for research focused on replacing less sustainable agricultural practices with more resilient indigenous systems. the emphasis on biodiversity, ecosystem functions, and food security aligns well with the goals of biotechnological research in enhancing ecosystem services."
54,"Rye as an Energy Cover Crop: Management, Forage Quality, and Revenue Opportunities for Feed and Bioenergy",Herbstritt et al.,2022,yes,"the abstract presents a comprehensive study on the use of winter rye as an energy cover crop, detailing its potential to meet food and energy demands while enhancing ecosystem services. the focus on biomass production, revenue generation from renewable sources, and greenhouse gas mitigation aligns well with biotechnological ecosystem service replacement research. the findings indicate a positive impact on forage quality and a carbon-negative footprint, which is crucial for sustainable agricultural practices. overall, the article appears to be relevant and suitable for the intended research field."
