Index,Article Title,Authors,Publication Year,Answer,Analysis
55,"Evaluating the contribution of wetlands to food security and livelihoods improvement in the Savelugu Municipality, Ghana",Atiim et al.,2022,yes,"the abstract presents a comprehensive evaluation of wetlands' roles in food security and livelihoods in ghana, focusing on their ecological and economic significance. it discusses the critical contributions of wetlands to agriculture and income generation, highlighting their underappreciation by policymakers, which can lead to degradation and overexploitation. the research incorporates methods to assess value and influence factors, making it relevant to biotechnological ecosystem service replacement research, particularly in understanding and potentially mitigating the impacts of degradation on these vital ecosystems."
56,Investment in Land Restoration: New Perspectives with Special Reference to Australia,Leake et al.,2021,yes,"the abstract discusses the interplay between biodiversity, ecosystem services, and changing agricultural practices, highlighting the need for institutionalizing non-food ecosystem markets. it emphasizes the importance of technology transfer and supply chain development, suggesting a potential role for biotechnology in enhancing ecosystem services. this aligns well with biotechnological ecosystem service replacement research, as it seeks to address ecological degradation through innovative solutions and market mechanisms."
60,Ultrasonic Welding of Banana/ Bagasse Based Polypropylene Composites,Rana et al.,2022,yes,"the abstract discusses the use of natural fiber-reinforced composites (nfrcs), specifically banana and bagasse fibers, highlighting their potential in developing sustainable products with minimal ecological impact. it emphasizes the importance of manufacturing processes and evaluates the mechanical properties of these composites, which is relevant to biotechnological ecosystem service replacement research. the focus on sustainability and the analysis of degradation behavior aligns well with the goals of improving ecosystem services through biotechnological advancements."
63,Conservation agriculture and resource management under jute (Corchorus spp.) based cropping systems in eastern India,Datta et al.,2020,yes,"the abstract discusses conservation agriculture (ca) technologies, which focus on sustainable agricultural practices that enhance productivity while benefiting the environment. it highlights the potential of ca in improving soil health and resource management, particularly in jute-based cropping systems in india. this aligns well with biotechnological ecosystem service replacement research, as it emphasizes innovative agricultural practices that can replace traditional methods and improve ecosystem services. the article's focus on policy and research needs further supports its relevance to the field."
64,Beef steer performance on African Bermuda grass pasture overseeded with black oat and annual ryegrass: effects of added irrigation and temperate legumes,Cavazzana et al.,2023,yes,"the abstract discusses sustainable intensification in grazing systems, focusing on the integration of forage legumes and irrigation to enhance beef cattle performance. this aligns well with biotechnological ecosystem service replacement research, as it addresses the degradation of ecosystem services and seeks innovative agricultural practices that improve productivity while maintaining environmental sustainability. the findings on the benefits of legumes and irrigation in grazing systems contribute valuable insights into enhancing ecosystem services in agricultural contexts."
66,Deciphering the Parts List for the Mechanical Plant,Somerville et al.,2012,yes,"the abstract discusses advancements in dna sequencing and genetic manipulation, highlighting their potential to enhance understanding of plant biology and diversity. this knowledge is crucial for addressing the increasing demand for ecosystem services, particularly in the context of climate change. the focus on mechanistic models and inventorying plant functions aligns well with biotechnological approaches aimed at ecosystem service replacement, suggesting that the research could provide valuable insights for sustainable solutions in this field."
67,Future Directions and Perspectives on Soil Environmental Researches,EUI et al.,2011,yes,"the abstract discusses the importance of soil in addressing various global challenges, including food security, climate change, and ecosystem health. it emphasizes the need for sustainable practices and the valuation of soil as an ecosystem service, which aligns well with biotechnological ecosystem service replacement research. the focus on enhancing soil functions and integrating biotechnological approaches to improve agricultural sustainability makes this article relevant to the field."
2,A review on solid adsorbents for carbon dioxide capture,Lee et al.,2015,maybe,"the abstract discusses co2 capture and storage (ccs) technologies, focusing on the development of efficient adsorbents for post-combustion co2 capture. while it addresses a critical environmental issue related to climate change, it primarily emphasizes technological advancements rather than the biotechnological aspects or ecosystem services specifically. therefore, it may provide relevant insights but does not directly align with the core principles of biotechnological ecosystem service replacement research."
3,Future scenarios of European agricultural land use II. Projecting changes in cropland and grassland,Rounsevell et al.,2005,maybe,"the abstract outlines a research paper that focuses on future agricultural land use in europe while analyzing the vulnerability of ecosystem services under various environmental change drivers. although it touches upon technological development and land use scenarios, it does not explicitly address biotechnological solutions or replacements for ecosystem services. the findings may offer insights into potential impacts on ecosystem services, but the direct relevance to biotechnological service replacement is less clear, which leads to a ""maybe"" classification."
17,Living with I-Fabric: Smart Living Powered by Intelligent Fabric and Deep Analytics,Chen et al.,2020,maybe,"the abstract discusses the development of intelligent fabrics integrated with sensors and ai for health monitoring, which could intersect with biotechnological ecosystem service replacement research. however, it primarily focuses on wearable technology and user experience rather than directly addressing ecosystem services or biotechnological applications in that context. the potential for creating a sustainable health monitoring ecosystem suggests some relevance, but it may not fully align with the core themes of ecosystem service replacement."
23,5G networks: Will technology and policy collide?,Frias et al.,2018,maybe,"the abstract discusses the implications of 5g networks and their potential conflicts with net neutrality regulations, focusing on network virtualization and the 'anything-as-a-service' paradigm. while it touches on innovation and ecosystem impacts, it does not explicitly address biotechnological ecosystem service replacement research. however, the mention of the ecosystem as a whole suggests some relevance, albeit indirectly. the connection to biotechnology and ecosystem services would need to be more clearly established for it to be deemed suitable."
25,Pressures on soil functions from soil management in Germany. A foresight review,Techen et al.,2017,maybe,"the abstract discusses sustainable soil management and its integration with various soil functions, which is relevant to ecosystem services. it highlights the importance of soil productivity, carbon sequestration, and biodiversity, all of which are crucial components of ecosystem services. however, it focuses primarily on soil management practices in an agricultural context rather than directly addressing biotechnological approaches to ecosystem service replacement. therefore, while it may provide useful insights, it may not be entirely focused on biotechnological solutions for ecosystem service replacement."
30,Open-Source Network Optimization Software in the Open SDN/NFV Transport Ecosystem,Garrich et al.,2019,maybe,"the abstract discusses the integration of software defined networking (sdn) and network function virtualization (nfv) in transport ecosystems, focusing on optimization and orchestration of networks. while it emphasizes the importance of joint optimization of network and it resources, it does not explicitly mention biotechnological applications or ecosystem service replacement. however, the concepts of optimization and resource management could potentially be applicable in biotechnological contexts, depending on how the findings are interpreted and implemented."
31,A theoretical model of agrobiodiversity as a supporting service for sustainable agricultural intensification,Omer et al.,2010,maybe,"the abstract discusses the interplay between agrobiodiversity conservation and sustainable agricultural intensification, which is relevant to biotechnological ecosystem service replacement research. it highlights how optimal resource adjustments can enhance both agrobiodiversity and agricultural productivity, suggesting that agrobiodiversity can serve as a supporting service for sustainable intensification. however, the focus is more on theoretical modeling and conditions for resource allocation rather than direct applications or methodologies in biotechnological ecosystem service replacement. thus, while it has relevant themes, it may not fully align with the specific focus of biotechnological ecosystem service replacement research."
32,Are Ecosystem Services Replaceable by Technology?,Fitter et al.,2013,maybe,"the abstract discusses the fundamental role of natural processes in delivering ecosystem services and evaluates the potential for technological replacements. it highlights both the limitations and possibilities of technology in enhancing or replacing these services, which is relevant to biotechnological ecosystem service replacement research. however, it also emphasizes the economic costs and the irreplaceability of certain services, suggesting a nuanced view that may not align perfectly with a purely biotechnological focus."
36,Prospects for cotton self-sufficiency in China by closing yield gaps,Wang et al.,2022,maybe,"the abstract discusses the assessment of cotton production capacity and self-sufficiency in china, focusing on yield gaps, production areas, and potential for expansion. while it doesn't explicitly address biotechnological ecosystem service replacement, it touches on aspects such as crop management and the potential for increased production, which could relate to biotechnological advancements in agriculture. however, the primary focus on yield gaps and economic self-sufficiency may limit its direct relevance to the specific field of biotechnological ecosystem service replacement research."
49,Digital entrepreneurship indicator (DEI): an analysis of the case of the greater Paris metropolitan area,Cornet et al.,2022,maybe,"the abstract discusses the digital entrepreneurship indicator (dei) and its application to the greater paris metropolitan area, focusing on the relationship between digital entrepreneurial ecosystems and small ict firms. while it highlights aspects of urbanization and economic factors, it does not directly address biotechnological ecosystem services or their replacement. however, the insights on entrepreneurial ecosystems could potentially inform research in biotechnology if the context is adapted to include biotechnological applications."
52,The Declining Ogallala Aquifer and the Future Role of Rangeland Science on the North American High Plains,Rhodes et al.,2023,maybe,"the abstract discusses the historical context and current challenges of water management in the ogallala aquifer region, emphasizing the need for innovative rangeland management practices to sustain ecosystem services. while it touches on agricultural practices and resource management, it does not explicitly focus on biotechnological solutions for ecosystem service replacement. however, the integration of improved agricultural practices could intersect with biotechnology, making it relevant to the broader discussion of biotechnological applications in ecosystem management."
65,Payload Capacities of Remotely Piloted Aerial Application Systems Affect Spray Pattern and Effective Swath,Martin et al.,2022,maybe,"the abstract discusses the use of unmanned aerial systems (uas) technology in agriculture, particularly for pest management, which could relate to biotechnological ecosystem service replacement. it highlights the integration of technology for improving agricultural practices, which is relevant to biotechnology. however, it does not explicitly address ecosystem services or their replacement, making it less directly applicable to that specific area of research. the focus is more on operational efficiency and pest management rather than on the broader implications for ecosystem services."
16,Multidimensional Convergence in Future 5G Networks,Ruffini et al.,2017,no,"the abstract primarily focuses on the technical aspects of 5g network development, including network convergence, application-centric approaches, and architectural frameworks. it does not address biotechnological ecosystem services or their replacement, which are essential for the research topic in question."
35,Toward Transport Ecosystem Interoperability Enabled by Vendor-Diverse Coherent Optical Sources Over an Open Line System,Filer et al.,2018,no,"the abstract discusses optical line-side interoperability in cloud service provision, focusing on networking technologies and vendor-specific platforms. it does not relate to biotechnological ecosystem service replacement, which typically involves biological, environmental, or ecological contexts. therefore, this article would not be suitable for that specific research area."
41,QoS-Aware Optical Fog-Assisted Cyber-Physical System in the 5G Ready Heterogeneous Network,Singh et al.,2021,no,"the abstract primarily discusses advancements in internet of things (iot) and cyber-physical systems (cps) related to 5g networks and their applications in remote monitoring and analytics. while these technologies can have implications for various sectors, including biotechnology, the focus on computational optical resources and surveillance systems does not align closely with biotechnological ecosystem service replacement research. the article appears more relevant to telecommunications and network efficiency rather than ecological or biotechnological contexts."
45,A Reliability and latency-aware routing framework for 5G transport infrastructures,Palmieri et al.,2020,no,"the abstract primarily focuses on the technical aspects of 5g technology, including its infrastructure, routing mechanisms, and performance optimization. it does not address biotechnological ecosystem services or their replacement, which are essential for the research topic in question. the content is more aligned with telecommunications and network engineering rather than biotechnology or ecosystem services."
57,Multi-Layer Service Provisioning Over Resilient Software-Defined Partially Disaggregated Networks,Mayoral et al.,2020,no,"the abstract primarily focuses on the technical aspects of software defined networks (sdn) and interoperability in transport networks, which does not directly relate to biotechnological ecosystem service replacement research. it discusses network architecture and service provisioning rather than ecological or biotechnological themes."
58,Dynamic Optical Networks for Future Internet Environments,Matera et al.,2014,no,"the abstract primarily focuses on the evolution of optical networks and their integration with technologies like cloud computing and the internet of things. it does not address biotechnological ecosystem services or their replacement, which are essential for the research topic in question. the content is more aligned with telecommunications and network technology rather than biotechnology or ecosystem services."
59,SDN-based band-adaptive quality assurance scheme in support of heterogenous B5G services over sliceable multi-band optical networks,Pages et al.,2023,no,"the abstract primarily focuses on advancements in optical networking technologies, specifically multi-band optical networks and their role in supporting 5g and beyond services. it discusses technical aspects such as network slicing, orchestration architecture, and quality assurance mechanisms, which are not directly related to biotechnological ecosystem service replacement research. the content lacks any mention of biotechnology or ecosystem services, making it unsuitable for the specified research area."
61,Metropolitan optical networks: A survey on single-layer architectures,Sousa et al.,2023,no,"the abstract primarily focuses on the advancements and challenges in metropolitan optical networks, particularly in the context of 5g and 6g technologies. it discusses network architectures, their implementation, and future research directions but does not relate to biotechnological ecosystem services or their replacement. the content is more aligned with telecommunications and networking rather than biotechnology."
62,Routing and Spectrum Allocation in Elastic Optical Networks for Ecosystem Monitoring,Mahala et al.,2021,no,"the abstract primarily focuses on elastic optical networks and their optimization for bandwidth allocation, which is more related to telecommunications and network efficiency rather than biotechnological ecosystem service replacement. while it mentions applications in agriculture and wildlife monitoring, the core content does not align with the specific needs of biotechnological ecosystem service research."
20,"Future yields of double-cropping systems in the Southern Amazon, Brazil, under climate change and technological development",Hampf et al.,2020,,
33,Sustaining our Natural Resources in the Face of Increasing Societal Demands on Agriculture: Directions for Future Research,Khanna et al.,2018,,
