Index,Article Title,Authors,Publication Year,Answer,Analysis
15,Challenges of mainstreaming green infrastructure in built environment professions,Zuniga-Teran et al.,2020,maybe,"the abstract discusses the implementation of green infrastructure (gi) in urban settings, focusing on its role in providing ecosystem services and enhancing urban resilience. it identifies key challenges such as design standards, regulatory pathways, and socio-economic considerations, which are relevant to biotechnological ecosystem service replacement research. however, it does not explicitly mention biotechnological approaches or innovations, which may limit its direct applicability to that specific field. the emphasis on stakeholder engagement and political will suggests a broader focus on urban planning rather than a concentrated study on biotechnological solutions."
19,Forest tree genomics: 10 achievements from the past 10 years and future prospects,Plomion et al.,2016,maybe,"the abstract discusses advancements in omics technologies and their applications in understanding tree biology, which could be relevant to biotechnological ecosystem service replacement research. it highlights the potential for these technologies to aid in adapting forests to changing ecosystem service demands and climate challenges. however, the focus is primarily on genomic research rather than directly on ecosystem services, which may limit its applicability to the specific area of ecosystem service replacement."
37,"Urban forest in China: Development patterns, influencing factors and research prospects",Li et al.,2005,maybe,"the abstract discusses the importance of urban forests in providing ecosystem services and highlights various factors influencing their development in china. while it touches on aspects relevant to biotechnological ecosystem service replacement, such as the role of urban forests in environmental management and the need for improved planning, it lacks a direct focus on biotechnological approaches or specific methodologies for ecosystem service replacement. the mention of social, climatic, and economic factors is relevant, but the abstract does not explicitly connect these to biotechnological solutions or innovations. thus, it may be suitable depending on the specific angle of the research being pursued."
39,Digging the backyard: Mining and quarrying in the UK and their impact on future land use,Bloodworth et al.,2009,maybe,"the abstract discusses the impact of mining and quarrying on land use and the broader implications for ecosystem services, particularly in the context of future demands influenced by various factors such as climate change and technological advancements. while it touches on ecosystem service provision, the primary focus is on mining and land use rather than directly on biotechnological ecosystem service replacement. therefore, it may provide relevant insights but might not be entirely suitable for research specifically centered on biotechnological approaches to ecosystem service replacement."
56,Are Ecosystem Services Replaceable by Technology?,Fitter et al.,2013,maybe,"the abstract discusses the fundamental role of ecosystem services and the challenges associated with replacing them technologically. it highlights both replacement and enhancement technologies, particularly in the context of supporting and final services. the mention of nutrient cycling and geoengineering indicates relevance to biotechnological approaches in ecosystem service replacement. however, the abstract also emphasizes the economic costs and the irreplaceability of many services, which could limit its applicability to specific biotechnological research. overall, while it touches on relevant themes, the focus on economic implications and irreplaceability may not align perfectly with all aspects of biotechnological ecosystem service replacement research."
71,Social networks influence farming practices and agrarian sustainability,Albizua et al.,2021,maybe,"the abstract discusses the social-ecological effects of agricultural intensification, focusing on farmers' perceptions and the implications of their land management practices. it highlights the contrast between modern technology adopters and traditional farmers, which is relevant to understanding how different agricultural practices impact ecosystem services. the mention of social networks and information flow among farmers also suggests a connection to how these dynamics can influence sustainable practices, which is pertinent to biotechnological ecosystem service replacement research. however, the abstract does not explicitly address biotechnological solutions or replacements for ecosystem services, which may limit its direct applicability to that specific area of research."
100,An Analysis of Agricultural Systems Modelling Approaches and Examples to Support Future Policy Development under Disruptive Changes in New Zealand,Vannier et al.,2022,maybe,"the abstract discusses the disruption in agricultural systems due to environmental regulations and emerging technologies, emphasizing the need for integrated modeling tools to address these challenges. while it touches on aspects relevant to ecosystem services, such as stakeholder engagement and land planning, it does not explicitly focus on biotechnological ecosystem service replacement. however, the mention of biotechnologies and their role in responding to agricultural disruptions suggests a potential connection to the topic. thus, it may be suitable depending on the specific focus of the research."
107,Tropical Wood Species Recognition: A Dataset of Macroscopic Images,Cano Saenz et al.,2022,maybe,"the abstract discusses the value of forests and the ecosystem services they provide, such as carbon storage and climate regulation, which are relevant to biotechnological ecosystem service replacement research. it highlights the challenges faced in forest management and the need for better tools to verify timber species, which could intersect with biotechnological approaches. the dataset of digital images for macroscopic analysis could be useful for researchers in forestry and related fields, potentially aiding in the development of biotechnological solutions. however, the focus seems more on traditional forestry and surveillance rather than direct biotechnological applications, which may limit its suitability for specific biotechnological ecosystem service replacement research."
110,METEOR: A Mobile (Portable) ocEan roboTic ObsErvatORy,Rajan et al.,2021,maybe,"the abstract discusses the importance of oceans as essential ecosystems and highlights the challenges in current ocean research methodologies. it proposes innovative technological solutions for improved observation and data collection, which could potentially inform biotechnological applications aimed at ecosystem service replacement. however, the focus on technological advancements and ocean observation rather than direct biotechnological applications may limit its relevance to the specific field of ecosystem service replacement research."
111,"Ocean Space and the Anthropocene, new notions in geosciences? - An essay",Stel et al.,2013,maybe,"the abstract discusses the concepts of ocean space and the anthropocene, emphasizing their relevance to sustainability challenges and the complex interactions between humans and the marine environment. it highlights the importance of ocean space in climate regulation and nutrient cycles, which are critical for understanding ecosystem services. however, it also critiques the anthropocene notion for potentially leading to a ""business as usual"" management style, which may not align with the goals of biotechnological ecosystem service replacement research. the focus on sustainability and the interactions between human activities and marine ecosystems suggests some relevance, but the critique of the anthropocene may indicate a divergence from traditional approaches in this field."
119,"Land, Water, and Climate Issues in Large and Megacities under the Lens of Nuclear Science: An Approach for Achieving Sustainable Development Goal (SDG11)",Rodrigues et al.,2022,maybe,"the abstract discusses the role of nuclear science and technology (nst) in addressing urban sustainability challenges, particularly in relation to the united nations 2030 agenda and sustainable development goal 11. while it emphasizes the importance of nst in socio-environmental contexts, it does not explicitly mention biotechnological ecosystem service replacement. however, the connection between nst and sustainability could imply potential overlaps with biotechnological approaches, making it relevant but not directly focused on the specific area of ecosystem service replacement."
121,Does Ecological Compensation Reduce Air Pollutant Emissions? - Evidence from Quasi-Natural Experiments in China,Lin et al.,2022,maybe,"the abstract discusses ecological compensation (ec) and its impact on air pollutant emissions, which is relevant to environmental policy and management. however, it focuses specifically on air quality rather than broader biotechnological ecosystem services. while the findings on promoting green technology innovation and improving energy efficiency could have implications for biotechnological applications, the primary focus on air pollution may limit its direct applicability to research specifically targeting biotechnological ecosystem service replacement."
122,Review of the underpinning reasons and field demonstrations to incorporate ecohydrologic strategy into landscape restoration in water-limited ecosystems,Belete et al.,2021,maybe,"the abstract discusses landscape restoration and identifies limitations in current water resource management practices that affect ecosystem sustainability. it emphasizes the need for innovative approaches, particularly through ecohydrology, which could be relevant to biotechnological ecosystem service replacement research. however, the focus on socio-economic and governance limitations may not directly align with the specific technological aspects of biotechnological solutions. the mention of ecohydrology as a scientific paradigm suggests potential applications in biotechnology, but the abstract does not explicitly address biotechnological methods or innovations. thus, while it may provide some relevant insights, it may not be fully suitable for research specifically focused on biotechnological ecosystem service replacement."
38,Interregional carbon compensation cost forecast and priority index calculation based on the theoretical carbon deficit: China as a case,Yang et al.,2019,,
54,Legal measures to prevent and manage soil contamination and to increase food safety for consumer health: The case of Spain,Ramon et al.,2019,,
70,InVEST Soil Carbon Stock Modelling of Agricultural Landscapes as an Ecosystem Service Indicator,Nel et al.,2022,,
