Index,Article Title,Authors,Publication Year,Answer,Analysis
82,Spatial E-PSR modelling for ecological sensitivity assessment for arid rangeland resilience and management,Raj et al.,2023,yes,"the abstract discusses critical issues related to land vulnerability and food security in semi-arid regions, particularly focusing on the aravalli range in india. it emphasizes the importance of rangeland ecosystem services and the need for conservation management practices. the study employs an integrative methodology to assess eco-sensitivity and resilience, which aligns well with biotechnological approaches aimed at ecosystem service replacement. the mention of using cutting-edge technology for monitoring also suggests a potential intersection with biotechnological innovations, making it relevant for research in this field."
83,A systematic review on the use of remote sensing technologies in quantifying grasslands ecosystem services,Masenyama et al.,2022,yes,"the abstract discusses the application of remote sensing technologies to quantify various ecosystem services provided by grasslands, including water-related services. it highlights the systematic review of existing literature, identifies gaps, and emphasizes the importance of understanding hydrological processes for effective water management. this focus on ecosystem services, particularly in the context of biotechnological applications and water management, aligns well with research on biotechnological ecosystem service replacement."
84,Ecological wetland paradigm drives water source improvement in the stream network of Yangtze River Delta,Wang et al.,2021,yes,"the abstract discusses the use of bypass riparian marshes and constructed root channel technology to purify micro-polluted water, presenting a promising approach to ecosystem service replacement. it highlights the ecological, economic, and social benefits of wetland systems in enhancing water quality and reducing reliance on chemical treatments. additionally, the emphasis on bionics and biomimetics indicates a relevant intersection with biotechnology. overall, the research contributes valuable insights and methodologies for biotechnological applications in ecosystem service restoration and replacement."
85,The role of industry and the private sector in promoting the 4 per 1000 initiative and other negative emission technologies,Lal et al.,2020,yes,"the abstract discusses the adoption of negative emission technologies (nets) and their role in soil carbon sequestration, which is directly relevant to biotechnological ecosystem service replacement research. it emphasizes the importance of industry involvement in promoting practices that enhance carbon sequestration and ecosystem services, aligning well with the goals of biotechnology in environmental sustainability. the mention of innovative agricultural practices and the potential for market-based incentives further supports its suitability for this research area."
86,"THE INFLUENCE OF URBAN PARK GREEN SPACES, PLANT MATERIAL SPECIFICATIONS AND SPATIAL DESIGN ORGANIZATION AND PATTERN TOWARDS CARBON SEQUESTRATION RATE",Othman et al.,2019,yes,"the abstract discusses the quantification of carbon sequestration in urban parks, highlighting the ecological functions of urban green spaces, such as air purification and carbon storage. it emphasizes the importance of plant specifications and spatial design in enhancing carbon sequestration rates, which aligns well with biotechnological ecosystem service replacement research. the findings could inform landscape design approaches aimed at mitigating carbon emissions, making it relevant to the field."
87,Bio-Based Products from Mediterranean Seaweeds: Italian Opportunities and Challenges for a Sustainable Blue Economy,Armeli Minicante et al.,2022,yes,"the abstract discusses the potential of seaweeds as a source of ecosystem services, particularly in the context of climate change mitigation and sustainable economies. it highlights their role in providing bio-based products and their applications in various industries, which aligns well with research on biotechnological ecosystem service replacement. the focus on sustainable seaweed farming and the analysis of the mediterranean region's research and industry further supports its relevance to the topic."
88,Changes in carbon storage since the pre-industrial era: A national scale analysis,Janes-Bassett et al.,2021,yes,"the abstract discusses the significant role of terrestrial carbon storage in ecosystem services, including climate regulation and sustainable land management. it highlights the impacts of anthropogenic activities on carbon storage and the necessity for quantifying these changes to inform land use policy. this aligns well with biotechnological ecosystem service replacement research, as understanding carbon dynamics is crucial for developing strategies to enhance ecosystem services through biotechnological interventions."
89,"Analysis of Land Use and Land Cover Changes through the Lens of SDGs in Semarang, Indonesia",Kelly-Fair et al.,2022,yes,"the abstract discusses land use and land cover changes (lulcc) in semarang, indonesia, and explores the implications of these changes through the lens of the united nations' sustainable development goals (sdgs). it highlights the use of geospatial analyses to understand the impact of urban expansion and agricultural transitions on ecosystem services. the focus on preserving terrestrial ecosystems while promoting sustainable urban development aligns well with research on biotechnological ecosystem service replacement, making it a suitable article for that field."
90,Greenhouse gas mitigation and carbon sequestration potential in humid grassland ecosystems in Brazil: A review,da Silva et al.,2022,yes,"the abstract discusses the impact of climate change on humid tropics, focusing on ecosystem services, carbon storage, and greenhouse gas emissions. it highlights the importance of adopting climate-smart agricultural technologies and improved management practices, which are relevant to biotechnological ecosystem service replacement research. the emphasis on technology adoption and management strategies aligns well with the goals of enhancing ecosystem services through biotechnological interventions."
91,Vegetation-based ecosystem service delivery in urban landscapes: A systematic review,Stroud et al.,2022,yes,"the abstract discusses the importance of urban green and blue spaces and their ecosystem services, which is relevant to biotechnological ecosystem service replacement research. it highlights the need for detailed studies on plant species and their specific roles in providing these services, indicating a gap that could be addressed through biotechnological approaches. the systematic review and emphasis on nature-based solutions also align with the objectives of this field."
92,Aquatic Vegetation Loss and Its Implication on Climate Regulation in a Protected Freshwater Wetland of Po River Delta Park (Italy),Gaglio et al.,2022,yes,"the abstract presents a study focusing on the loss of aquatic vegetation and its impact on ecosystem services, particularly carbon sequestration and storage. it highlights the importance of phragmites australis-dominated wetlands in mitigating climate change, making it relevant for biotechnological ecosystem service replacement research. the findings emphasize the need to understand and restore these ecosystems to maintain their carbon sink capacity, which can inform biotechnological strategies for ecosystem service enhancement."
93,"Sustainability of agricultural production following deforestation in the tropics: Evidence on the value of newly-deforested, long-deforested and forested land in the Brazilian Amazon",Mullan et al.,2021,yes,"the abstract discusses the long-term agricultural potential of cleared land following tropical deforestation, emphasizing the importance of understanding land value dynamics for effective policy-making related to deforestation, reforestation, and agricultural practices. this aligns well with biotechnological ecosystem service replacement research, as it highlights the interplay between agricultural productivity, land management, and ecosystem services, which are critical areas of interest in biotechnology and environmental sustainability."
94,"Application of remote sensing in alpine grasslands cover mapping of western Himalaya, Uttarakhand, India",Pandey et al.,2021,yes,"the abstract discusses the assessment of grassland ecosystems, particularly in the alpine region of uttarakhand, and highlights their importance in providing various ecosystem services such as carbon storage and biodiversity support. it also addresses the threats these ecosystems face due to human activities and climate change, which aligns well with biotechnological ecosystem service replacement research. the use of satellite data and ground truth points for assessing grass cover indicates a methodological approach that could be relevant for developing biotechnological solutions to restore or replace these services."
95,Sustainable grazing land management to protect ecosystem services,Diaz-Pereira et al.,2020,yes,"the abstract discusses sustainable grazing land management (sglm) and its role in preventing land degradation while supporting food security and ecosystem services. it emphasizes the need for quantifying the impacts of sglm on ecosystem services, which aligns well with biotechnological ecosystem service replacement research. the study evaluates various sglm technologies and their socioeconomic and environmental impacts, making it relevant for understanding how biotechnological approaches can enhance ecosystem services in sustainable land management."
96,Evaluating the provision of ecosystem services to support phytoremediation measures for countering soil contamination. A case-study of the Guadiamar Green Corridor (SW Spain),Blanco-Velazquez et al.,2020,yes,"the abstract discusses a methodology for evaluating forest species' potential distribution and carbon sequestration in contaminated soils, particularly under climate change scenarios. this aligns well with biotechnological ecosystem service replacement research, as it focuses on using native plants for soil remediation and assessing their ecosystem service provision. the emphasis on sustainability and decision-making in afforestation planning further supports its relevance to the field."
97,A discrete mathematical extension of conceptual ecological models - Application for the SE Florida shelf,Elmer et al.,2014,yes,"the abstract discusses the development of a quantitative extension of a conceptual ecological model (cem) to improve management of natural resources, specifically in the context of the se florida shelf. it highlights how this model can identify stressors and drivers affecting ecosystems and explores management scenarios that could enhance reef diversity and health. this focus on quantifying ecological impacts and management strategies aligns well with biotechnological ecosystem service replacement research, making the article suitable for that field."
98,Fine-tuning the BFOLDS Fire Regime Module to support the assessment of fire-related functions and services in a changing Mediterranean mountain landscape,Sil et al.,2022,yes,"the abstract discusses the evaluation of fire simulation models, specifically the bfolds fire regime module, and its application in assessing fire regime attributes in a mediterranean landscape. it emphasizes the importance of understanding these models to enhance their reliability in ecosystem service research, particularly in climate regulation. the findings highlight how the model can inform sustainable management of fire-prone areas, which aligns well with biotechnological ecosystem service replacement research. the focus on landscape fire regulation capacity and its implications for ecosystem services makes it relevant to the field."
99,Soil management priorities in Korea,Jeon et al.,2022,yes,"the abstract discusses sustainable soil management in korea, emphasizing its role in enhancing soil ecosystem services and addressing threats such as erosion and pollution. this aligns well with biotechnological ecosystem service replacement research, as it highlights the integration of technology and policy to improve soil health and productivity, which are crucial for sustainable agriculture. the focus on mitigating climate change and improving environmental quality further supports its relevance to the field."
101,Spatial-temporal dynamics of mangrove extent in Quang Ninh Province over 33 years (1987-2020): Implications toward mangrove management in Vietnam,Nguyen et al.,2022,yes,"the abstract presents a detailed analysis of mangrove forest dynamics using remote sensing technology, highlighting the impacts of deforestation on coastal ecosystem services. it identifies key drivers of mangrove loss and suggests community-based management and blue carbon approaches, which are relevant to biotechnological ecosystem service replacement research. the focus on quantifying changes over time and the mention of economic benefits make it suitable for understanding how to replace or restore these essential services."
102,Sustainable Feasibility of the Environmental-Friendly Policies on Agriculture and Its Related Sectors in India,Debbarma et al.,2021,yes,"the abstract discusses the environmental efficiency of agricultural firms in india and evaluates the impact of agricultural practices on greenhouse gas emissions. it emphasizes the need for stronger regulations and financial measures to promote sustainable agriculture, which aligns with the goals of biotechnological ecosystem service replacement research. the focus on improving agricultural practices through policy changes and the use of biotechnology to enhance environmental efficiency makes it relevant to the field."
103,Quantitative Analysis of Spatio-Temporal Evolution of Ecosystem Structure in the Water-Land Interaction Area of Nansi Lake Based on Remote Sensing Technology,Ma et al.,2021,yes,"the abstract discusses the use of remote sensing technology to monitor ecological environments and analyze ecosystem structure changes over time. it highlights the importance of understanding ecosystem dynamics, which is relevant for biotechnological ecosystem service replacement research. the findings about the impact of human activities and climate change on ecosystem structure can inform strategies for sustainable development and ecosystem management, aligning well with the goals of biotechnological interventions."
104,Socioeconomic and Environmental Proxies for Comparing Freshwater Ecosystem Service Threats across International Sites: A Diagnostic Approach,Harmon et al.,2018,yes,"the abstract discusses the development and testing of diagnostic tools for assessing freshwater ecosystem services (fwes) risks, which is directly relevant to biotechnological ecosystem service replacement research. it highlights the increasing threats to fwes from various factors and emphasizes the importance of establishing benchmarks for these threats. the study's focus on using proxies for assessing fwes risks and its implications for coordinated research efforts align well with the goals of understanding and potentially replacing ecosystem services through biotechnological means."
105,How resilient are waterways of the Asian Himalayas? Finding adaptive measures for future sustainability,Kattel et al.,2023,yes,"the abstract discusses the significant challenges faced by high-mountain ecosystems, particularly in the himalayas, due to climate change and human activities. it emphasizes the importance of sustainable management of waterways, which are crucial for ecosystem services that support a large population. the focus on adaptive measures and integrated management aligns well with biotechnological approaches aimed at ecosystem service replacement, making it relevant to the field. the article's assessment of current literature and recommendations for sustainable practices further supports its suitability for research in this area."
106,"Enset farming system - a resilient, climate-robust production system in South and South-Western Ethiopia",Senbeta et al.,2022,yes,"the abstract discusses the enset farming system's ecosystem services, resilience to climate change, and the implications of replacing it with other crops. it highlights the sustainability and multifunctionality of enset, making it relevant for biotechnological ecosystem service replacement research. the emphasis on ecosystem services, food security, and resilience aligns well with current trends in biotechnology and sustainable agriculture."
108,"Evaluating the contribution of wetlands to food security and livelihoods improvement in the Savelugu Municipality, Ghana",Atiim et al.,2022,yes,"the abstract discusses the critical role of wetlands in food security and livelihoods, highlighting their contributions and the factors influencing their utilization. it emphasizes the need for policy recognition and sustainable management of wetland ecosystems, which is relevant to biotechnological research aimed at ecosystem service replacement. the mention of degradation issues and overexploitation suggests a need for innovative biotechnological solutions to restore and maintain wetland functions and services."
109,Sustainability Evaluation and Optimization on the Modern Agro-Pastoral Circular System Integrating Emergy Analysis and Life Cycle Assessment,Shen et al.,2022,yes,"the abstract discusses the integration of emergy analysis and life cycle assessment to evaluate and optimize a circular agricultural system, which aligns with biotechnological ecosystem service replacement research. it highlights the importance of accurate data and parameter matching in enhancing sustainability, making it relevant for studies focused on improving ecosystem services through biotechnological methods. the findings indicate a significant reduction in environmental impacts, supporting the objectives of sustainable agricultural practices."
112,Importance of Blue Carbon in Mitigating Climate Change and Plastic/Microplastic Pollution and Promoting Circular Economy,Bandh et al.,2023,yes,"the abstract discusses the significant role of blue carbon ecosystems in climate change adaptation and mitigation, highlighting their benefits such as carbon sequestration, biofuel production, and pollution remediation. it emphasizes the need for interdisciplinary collaboration and proper policy frameworks, which align with the goals of biotechnological ecosystem service replacement research. the focus on coastal ecosystems and their services makes it relevant for studies examining alternatives and enhancements in ecosystem services through biotechnological approaches."
113,Perspectives of human-water co-evolution of blue-green water resources in subtropical areas,Pan et al.,2023,yes,"the abstract discusses the transformation of blue-green water resources and their implications for crop production and ecosystem services, particularly in the context of policy-driven projects like china's grain for green project. it highlights the relationship between water resource management and socio-economic development, which is relevant to biotechnological ecosystem service replacement research. the findings suggest that the project successfully increased green water resources while maintaining ecological health, providing insights that could inform similar biotechnological approaches in other regions."
114,An evaluation of ecosystem services as a result of land use changes in inland and coastal areas: a comparative study of Beijing and Freetown,Abd El-Hamid et al.,2022,yes,"the abstract discusses the impact of land use and land cover changes on ecosystem services, specifically focusing on the assessment of ecosystem services value (esv) in two different locations over time. it highlights the importance of sustainable resource utilization and effective land-use regulations, which are crucial aspects of biotechnological ecosystem service replacement research. the integration of gis technology and economic valuation methods further supports its relevance to the field."
115,"Biodiversity Conservation of National Parks and Nature-Protected Areas in West Africa: The Case of Kainji National Park, Nigeria",Tang et al.,2022,yes,"the abstract discusses the critical importance of biodiversity conservation in the context of climate change, specifically focusing on kainji national park in west africa. it highlights the role of protected areas in enhancing ecosystem services, such as carbon storage and pollution removal, which are essential for a sustainable environment. the study employs advanced methodologies to analyze various ecological parameters, making it relevant for research on biotechnological ecosystem service replacement. the emphasis on conservation aligns with the goals of sustainable development and climate action, indicating its suitability for the field."
116,Valuing the Impact of Forest Disturbances on the Climate Regulation Service of Western US Forests,Marcos-Martinez et al.,2022,yes,"the abstract discusses the critical role of forest carbon sinks in climate-change mitigation and examines the impacts of forest disturbances on these carbon sinks. it highlights the importance of spatially explicit management of forest disturbances to enhance carbon sequestration, which aligns well with biotechnological ecosystem service replacement research. the findings on social costs and future trends under climate projections provide valuable insights for developing strategies to replace or enhance ecosystem services through biotechnological means."
117,Assessing remote sensing as a tool to monitor hydrological stress in Irish catchments with Freshwater Pearl Mussel populations,Kuemmerlen et al.,2022,yes,"the abstract discusses the decline of freshwater pearl mussels (fpm) in relation to hydrological conditions and the potential for remote sensing indices to monitor these conditions. it highlights the importance of land-use management strategies to mitigate drought effects on fpm, which aligns with biotechnological ecosystem service replacement research. the focus on enhancing hydrological resilience and biodiversity conservation through innovative monitoring techniques is particularly relevant to the field."
118,"Impacts of Societal Development on the Evolution of Ecosystem Services in the Heihe River Basin, China",Wu et al.,2023,yes,"the abstract discusses the impacts of societal drivers on ecosystem services (es) in the heihe river basin, focusing on the trade-offs between different types of ess, such as food provision and groundwater maintenance. it emphasizes the need for rational water allocation and the connection between societal development and ecosystem benefits, which aligns well with biotechnological ecosystem service replacement research. the examination of societal influences on es degradation and the call for sustainable management practices are particularly relevant to the field."
120,Development of green economy in Russia: legal aspects,Ryzhenkov et al.,2022,yes,"the abstract discusses the development of a green economy in russia, emphasizing economic incentives, legal frameworks, and organizational measures to enhance the efficiency of natural resource use and reduce environmental impact. this aligns well with biotechnological ecosystem service replacement research, as it highlights the importance of sustainable practices and technologies that can contribute to ecosystem health and resilience. the focus on public-private partnerships and environmental investments also suggests a framework that could support biotechnological innovations aimed at ecosystem service enhancement."
123,Animal board invited review: OneARK: Strengthening the links between animal production science and animal ecology,Destoumieux-Garzon et al.,2021,yes,"the abstract discusses the critical roles of wild and farmed animals in ecosystem services, such as pollination and nutrient cycling, which are essential for biodiversity and sustainability. it emphasizes the need for interdisciplinary approaches between animal production science and ecology to enhance ecosystem resilience and farming sustainability. the focus on animal adaptability, diversity, and management aligns well with research on biotechnological ecosystem service replacement, making it a suitable article for this field."
12,"Changes in land-use and ecosystem services in the Guangzhou-Foshan Metropolitan Area, China from 1990 to 2010: Implications for sustainability under rapid urbanization",Ye et al.,2018,maybe,"the abstract discusses the impact of rapid urbanization on ecosystem services in a specific region of china, highlighting the need for bespoke analyses to support sustainability. while it addresses ecosystem services and their valuation, it does not explicitly focus on biotechnological approaches or replacements for ecosystem services. however, the insights gained from the study could inform biotechnological solutions aimed at mitigating the negative impacts of land-use changes, making it potentially relevant to biotechnological ecosystem service replacement research."
