Index,Article Title,Authors,Publication Year,Answer,Analysis
43,The deep sea: The new frontier for ecological restoration,Da Ros et al.,2019,yes,"the abstract discusses the importance of deep-sea ecosystems in providing essential goods and services, such as genetic resources and climate regulation, which are crucial for human well-being. it highlights the need for protection and restoration of these ecosystems due to human and climate-induced impacts. the mention of deep-sea restoration actions and the challenges associated with them, including the need for a better understanding of biodiversity and ecosystem resilience, aligns well with biotechnological ecosystem service replacement research. additionally, the potential for technological development and investment in natural capital for blue-growth sectors indicates a direct relevance to biotechnological applications in ecosystem restoration."
44,Challenges and opportunities for large-scale reforestation in the Eastern Amazon using native species,Nunes et al.,2020,yes,"the abstract discusses the challenges and opportunities associated with large-scale reforestation and forest restoration, particularly in the context of enhancing ecosystem services such as carbon sequestration and water resource protection. it emphasizes the importance of using native species and addresses the socioeconomic benefits of reforestation, which aligns well with research on biotechnological ecosystem service replacement. the focus on biodiversity maintenance and the need for effective management strategies further supports its relevance to the field."
45,A review of preferential water flow in soil science,Zhang et al.,2018,yes,"the abstract discusses the importance of preferential water flow in relation to water-related crises, highlighting both its positive and negative impacts on eco-hydrology and ecosystem services. it emphasizes the need for further research to understand these dynamics, which is relevant to biotechnological ecosystem service replacement research. the focus on water retention, nutrient cycling, and the regulation of the water cycle aligns well with the goals of enhancing ecosystem services through biotechnological approaches."
46,IoT Monitoring of Urban Tree Ecosystem Services: Possibilities and Challenges,Matasov et al.,2020,yes,"the abstract discusses the use of iot technology for real-time monitoring of urban green infrastructure, specifically focusing on the ecosystem services provided by trees in an urban setting. it highlights the quantification of various ecosystem services such as climate regulation, air quality improvement, and water management, which are crucial for understanding and replacing biotechnological ecosystem services. the findings emphasize the importance of monitoring and managing urban forests to enhance their ecological functions, making it relevant for research on ecosystem service replacement in biotechnology."
47,Biochar use in forestry and tree-based agro-ecosystems for increasing climate change mitigation and adaptation,Stavi et al.,2013,yes,"the abstract discusses the use of biochar as a soil amendment in various land management practices, highlighting its potential for carbon sequestration and climate change mitigation. this aligns well with biotechnological ecosystem service replacement research, as it explores how biochar can enhance soil quality and resilience, which are crucial for sustainable ecosystem services. additionally, the mention of economic assessments and regulatory frameworks for biochar application indicates a comprehensive approach to integrating biotechnology into ecosystem service strategies."
48,Estimating water-food-ecosystem trade-offs for the global negative emission scenario (IPCC-RCP2.6),Yamagata et al.,2018,yes,"the abstract discusses the implications of deploying bioenergy with carbon capture and storage (beccs) on land systems, including its effects on land use, water resources, and ecosystem services. it highlights critical issues such as the potential loss of food production, increased water consumption, and degradation of ecosystem services due to land conversion for bioenergy crops. these aspects are directly relevant to biotechnological ecosystem service replacement research, as they address the balance between technological solutions for carbon capture and the sustainability of ecosystem services that support human life."
49,Valuing albedo as an ecosystem service: implications for forest management,Lutz et al.,2014,yes,"the abstract discusses the economic valuation of surface albedo as an ecosystem service, particularly in the context of forest management. it highlights how the cooling effect of albedo can be more significant than carbon sequestration in certain forest types, which is relevant for biotechnological ecosystem service replacement research. the findings suggest that incorporating albedo valuation can lead to shorter optimal rotation periods for timber, indicating a potential shift in forest management practices that could be influenced by biotechnological interventions."
50,"The biophysical link between climate, water, and vegetation in bioenergy agro-ecosystems",Bagley et al.,2014,yes,"the abstract discusses the impacts of land use change for bioenergy feedstocks, focusing on both biogeochemical and biophysical ecosystem services. it highlights the potential for bioenergy crops to provide climate-regulating services while also addressing the direct biophysical impacts on climate and water. this dual focus on ecosystem services aligns well with research on biotechnological ecosystem service replacement, making the article suitable for that field. additionally, the review of biophysical feedbacks and the implications for policy decisions further supports its relevance to the topic."
51,A socio-ecological framework supporting catchment-scale water resource stewardship,Everard et al.,2019,yes,"the abstract discusses the need to align human resource demands with the renewable capacities of ecosystems, particularly in the context of water resource management. it highlights the challenges posed by traditional resource exploitation models that often overlook the sustainability of ecosystems. the focus on catchment ecosystem services and the impacts of technology choices aligns well with biotechnological ecosystem service replacement research, as it emphasizes the importance of recognizing and mitigating externalities in resource management. this makes the article relevant for exploring sustainable practices in biotechnology and ecosystem services."
52,"Remaking stormwater as a resource: Technology, law, and citizenship",Cousins et al.,2018,yes,"the abstract discusses the innovative management of stormwater as a resource rather than a waste issue, highlighting its potential to address urban water quality and quantity challenges. this aligns well with biotechnological ecosystem service replacement research, as it emphasizes the role of green infrastructure and technological advancements in transforming stormwater management. the focus on integrating diverse knowledge and citizen involvement in governance also supports the idea of enhancing ecosystem services through biotechnological approaches."
53,Assessment of the Hydro-Ecological Impacts of the Three Gorges Dam on China's Largest Freshwater Lake,Wu et al.,2017,yes,"the abstract discusses the ecological impacts of the three gorges dam on poyang lake, specifically focusing on how changes in inundation patterns affect vegetation and overall ecosystem composition. the research combines various scientific methodologies to analyze these changes, which are crucial for understanding ecosystem services in the context of biotechnological applications. given its focus on hydrological alterations and their implications for ecosystem management, the article is suitable for biotechnological ecosystem service replacement research."
55,The relevance of ecological status to ecosystem functions and services in a large boreal lake,Tolonen et al.,2014,yes,"the abstract discusses the relationship between ecological status and ecosystem services, particularly in the context of aquatic ecosystems and the water framework directive (wfd). it emphasizes the importance of demonstrating how ecological status correlates with biodiversity, ecosystem functions, and services, which is directly relevant to biotechnological ecosystem service replacement research. the findings suggest that improving ecological status can enhance ecosystem service supplies, making it a suitable article for understanding how biotechnology might contribute to ecosystem service management and replacement."
57,Assessment and valuation of key ecosystem services provided by two forest ecosystems in Turkey,Baskent et al.,2021,yes,"the abstract discusses the quantification and valuation of various ecosystem services, including wood production, carbon sequestration, and biodiversity habitat, which are all relevant to biotechnological ecosystem service replacement research. it emphasizes the economic value of these services and suggests strategies for sustainable forest management, aligning well with the goals of biotechnology in enhancing ecosystem services. the focus on spatial distribution and the use of valuation methods also supports the integration of biotechnological approaches in ecosystem service management."
58,Policy-driven changes in enclosure fisheries of large lakes in the Yangtze Plain: Evidence from satellite imagery,Dai et al.,2019,yes,"the abstract discusses the impact of enclosure fisheries on the environment and the subsequent policy changes aimed at restoring ecosystem functions in the yangtze plain. it highlights the relationship between aquaculture practices and environmental degradation, which is directly relevant to biotechnological ecosystem service replacement research. the findings provide baseline information for future environmental monitoring and restoration, indicating potential applications in similar contexts, thus aligning well with the goals of ecosystem service replacement research."
59,"Assessing the variable ecosystem services relationships in polders over time: a case study in the eastern Chaohu Lake Basin, China",Zhang et al.,2016,yes,"the abstract discusses the impact of land use changes on ecosystem services, specifically in the context of habitat fragmentation and its effects on ecological processes. it highlights the importance of analyzing how these services respond over time, which is directly relevant to biotechnological ecosystem service replacement research. the use of methodologies like remote sensing and geographical information systems indicates a modern approach to studying these changes, making the findings applicable to the field of biotechnology and ecosystem management. the identification of trade-offs and synergies among various ecosystem services further supports its relevance to research focused on replacing or enhancing ecosystem services through biotechnological means."
60,Challenges and Strategies for Sustainable Mangrove Management in Indonesia: A Review,Arifanti et al.,2022,yes,"the abstract discusses the importance of mangroves in providing social, economic, and environmental services, which aligns well with biotechnological ecosystem service replacement research. it highlights indonesia's commitment to sustainable mangrove management and addresses the complex challenges faced in this area. the use of swot analysis to evaluate management strategies and the emphasis on integrating research and innovations further supports its relevance to biotechnological applications in ecosystem service replacement."
61,Sustainable Design of Urban Rooftop Food-Energy-Land Nexus,Jing et al.,2020,yes,"the abstract discusses urban rooftop functional design as a means to enhance multi-functional land use, specifically focusing on ecosystem services such as food production and energy supply. it proposes a modeling framework that integrates biogeochemical simulation and energy system optimization, which aligns well with research on ecosystem service replacement in biotechnological contexts. the evaluation of different rooftop agriculture options and their impact on urban energy systems indicates a clear relevance to the field of biotechnological ecosystem service replacement."
62,Enhancing ecosystem services through targeted bioenergy support policies,Baumber et al.,2017,yes,"the abstract discusses the potential of bioenergy policies to enhance ecosystem services, such as habitat provision, soil health, and water quality, which aligns well with research on biotechnological ecosystem service replacement. it emphasizes the need for policy adaptations to support beneficial energy crops, indicating a direct connection to the role of biotechnology in promoting sustainable practices within ecosystems. the focus on trade-offs and risks also suggests a comprehensive approach that is relevant to the field of ecosystem services."
63,Connecting air quality regulating ecosystem services with beneficiaries through quantitative serviceshed analysis,Charles et al.,2020,yes,"the abstract discusses the concept of servicesheds, which connects ecosystem services to specific beneficiaries, and emphasizes the use of mathematical, spatially-explicit models to analyze air quality regulating ecosystem services. this aligns well with biotechnological ecosystem service replacement research, as it explores quantitative definitions and applications that can inform ecosystem management and restoration decisions. the focus on a case study involving a biodiesel manufacturing site also suggests practical implications for biotechnological applications in ecosystem service management."
64,Ecosystem services provided by freshwater and marine diatoms,B-Beres et al.,2023,yes,"the abstract discusses various ecosystem services provided by diatoms, including their roles in supporting, regulating, provisioning, and cultural services. it highlights their importance in human well-being, potential biotechnological applications (such as medicines and wastewater treatment), and the necessity of protecting their habitats. this focus aligns well with biotechnological ecosystem service replacement research, as it emphasizes both the ecological and practical aspects of diatoms in biotechnology."
65,The NDVI-CV Method for Mapping Evergreen Trees in Complex Urban Areas Using Reconstructed Landsat 8 Time-Series Data,Yang et al.,2019,yes,"the abstract discusses the role of evergreen trees in urban ecological services, emphasizing their importance in air purification, carbon and oxygen balance, and temperature regulation. it also introduces a novel method for extracting data on these trees using remote sensing, which is crucial for understanding and managing urban ecosystems. this aligns well with biotechnological ecosystem service replacement research, as it focuses on enhancing the understanding and management of urban green spaces, which are vital for ecosystem services."
66,Conserving the Cerrado and Amazon biomes of Brazil protects the soy economy from damaging warming,Flach et al.,2021,yes,"the article is suitable for biotechnological ecosystem service replacement research as it focuses on the impacts of ecosystem loss on agricultural productivity, specifically soy production in the brazilian amazon and cerrado regions. it models the economic implications of extreme heat regulation values linked to ecosystem conservation, which is relevant for understanding how biotechnological interventions could mitigate the effects of environmental changes on agricultural systems. the research highlights the importance of maintaining native vegetation for regulating extreme heat, which aligns with the goals of ecosystem service replacement in biotechnology."
67,A Biophysical and Economic Profile of South Georgia and the South Sandwich Islands as Potential Large-Scale Antarctic Protected Areas,Rogers et al.,2015,yes,"the abstract discusses the importance of marine protected areas (mpas) in the antarctic, particularly focusing on the u.k. overseas territories of south georgia and south sandwich islands. it highlights the unique biological features and the need for better conservation measures, which aligns with the concept of ecosystem services. the mention of technology for managing mpas and the exploration of non-use values and ecosystem services indicates relevance to biotechnological ecosystem service replacement research."
68,Knowledge and tools to enhance resilience of beef grazing systems for sustainable animal protein production,Steiner et al.,2014,yes,"the abstract discusses the role of ruminant livestock in providing essential ecosystem services and the economic importance of beef production in the southern great plains. it emphasizes the integration of various disciplines to enhance resilience and productivity in the context of changing environmental conditions. this focus on ecosystem services, management practices, and adaptation strategies aligns well with biotechnological ecosystem service replacement research, as it seeks to address vulnerabilities and improve sustainability in agricultural systems."
69,"Changes in carbon stocks and its economic valuation under a changing land use pattern-A multitemporal study in Konar catchment, India",Rajbanshi et al.,2021,yes,"the abstract discusses the significant impact of land use and land cover (lulc) changes on carbon storage and ecosystem services, particularly in the context of climate regulation. it employs models like the markov chain and invest to analyze and predict changes in carbon dynamics, which are crucial for understanding ecosystem service replacement. the focus on monetary valuation of carbon loss and gain further aligns with biotechnological ecosystem service replacement research, making it a suitable article for this field."
72,The INCA-Pathogens model: An application to the Loimijoki River basin in Finland,Rankinen et al.,2016,yes,"the abstract discusses the use of the inca-pathogens model to assess water quality and ecosystem services related to water purification and provisioning in the loimijoki river basin. it highlights the importance of maintaining good hygienic quality of surface waters for drinking, irrigation, and recreation, which aligns well with biotechnological ecosystem service replacement research. the findings regarding the impact of agricultural practices and climate change on water quality are particularly relevant for developing biotechnological solutions to enhance ecosystem services."
73,Enhancing the economic viability of pastoralism: the need to balance interventions,Rueff et al.,2016,yes,"the abstract discusses the complexities of extensive mobile pastoral systems and their contributions to national economies, emphasizing the need for investment and tailored policies to support these systems. it highlights the ecosystem services provided by pastoralists and the potential risks associated with interventions in their marketing and production processes. this focus on ecosystem services and the integration of pastoral systems into broader market frameworks aligns well with research on biotechnological ecosystem service replacement, making the article suitable for that field."
74,"Environmental, Ecological, and Economic Benefits of Biofuel Production Using a Constructed Wetland: A Case Study in China",Liu et al.,2019,yes,"the abstract presents a study on constructed wetlands (cws) as a dual-purpose system for wastewater treatment and biofuel production. it highlights significant biomass yields and environmental benefits, indicating that cws can outperform traditional biofuel systems in both energy gain and greenhouse gas emissions reduction. additionally, it discusses the ecosystem services provided by cws, such as climate regulation and habitat conservation, making it relevant to biotechnological ecosystem service replacement research. overall, the findings suggest promising applications for cws in sustainable bioenergy and ecosystem management."
75,Reducing intensification by shifting cultivation through sustainable climate-smart practices in tropical forests: A review in the context of UN Decade on Ecosystem Restoration,Villa et al.,2021,yes,"the abstract discusses the significant ecosystem services provided by tropical forests and the impacts of shifting cultivation on these ecosystems. it highlights the need for sustainable practices, such as agroforestry, to rehabilitate degraded forests and restore ecosystem services. this aligns well with biotechnological ecosystem service replacement research, as it emphasizes the role of innovative agricultural practices in enhancing biodiversity and mitigating climate change effects. the focus on the un decade on ecosystem restoration further supports its relevance to current environmental restoration efforts."
76,Emerging water and carbon market opportunities for environmental water and climate regulation ecosystem service provision,Settre et al.,2019,yes,"the abstract discusses the integration of market mechanisms for ecosystem services, specifically focusing on carbon credits and water markets. it highlights the potential synergies and risks associated with joint provision strategies, which is highly relevant to biotechnological ecosystem service replacement research. the study's methodology and findings on the economic viability of reallocating water for environmental benefits through carbon credit sales align well with the goals of understanding and improving ecosystem services through biotechnological approaches."
77,"The LEGATO cross-disciplinary integrated ecosystem service research framework: an example of integrating research results from the analysis of global change impacts and the social, cultural and economic system dynamics of irrigated rice production",Spangenberg et al.,2018,yes,"the abstract describes a comprehensive research project (legato) that investigates the interdependencies of rice-dominated socio-ecological systems on ecosystem functions and services. it emphasizes the integration of various disciplines, including biosciences and social sciences, to analyze the impacts of biological, climatic, and soil conditions on ecosystem services. the focus on ecological engineering principles and sustainable land management strategies aligns well with biotechnological ecosystem service replacement research, as it seeks to optimize ecosystem services through natural regulation mechanisms. this makes the article relevant and suitable for the specified research area."
78,A review of seagrass ecosystem services: providing nature-based solutions for a changing world,do Amaral Camara Lima et al.,2023,yes,"the abstract discusses the various ecosystem services provided by seagrasses, including provisioning, regulating, supporting, and cultural services. it highlights the importance of understanding these services as nature-based solutions to societal challenges, particularly in the context of climate change. the focus on identifying knowledge gaps and suggesting novel technologies for research aligns well with biotechnological ecosystem service replacement research, as it emphasizes the need for innovative approaches to manage and preserve seagrass ecosystems effectively."
79,Review: More effective linkages between science and policy are needed to minimize the negative environmental impacts of livestock production,Gill et al.,2021,yes,"the abstract discusses the critical balance between livestock production and ecosystem services, emphasizing the negative impacts of increased livestock numbers on sustainability. it highlights the need for better policies and technologies to manage these impacts, which aligns well with biotechnological ecosystem service replacement research. the focus on indicators for monitoring environmental impacts and the role of livestock in utilizing by-products during extreme weather events further supports its relevance to the field. overall, the article appears to contribute valuable insights into the intersection of animal science, technology, and ecosystem management."
80,"Distribution of soil organic carbon in Wadi Al-Thulaima, Saudi Arabia: A hyper-arid habitat altered by wastewater reuse",El-Sheikh et al.,2018,yes,"the abstract discusses the significance of artificial wetlands in carbon sequestration, particularly in arid regions like saudi arabia. it highlights the vertical distribution of soil organic carbon (soc) and how vegetation impacts soc pools, which is crucial for understanding ecosystem services related to carbon cycling. this aligns well with biotechnological ecosystem service replacement research, as it addresses both ecological processes and potential management strategies for enhancing soil quality and carbon storage."
81,GIS-based assessment of ecosystem service demand concerning green infrastructure line-side vegetation,Hoerbinger et al.,2018,yes,"the abstract discusses a module-based approach to green infrastructure (gi) and ecosystem services (es) specifically for railway line-side vegetation management. it emphasizes the integration of gi and es concepts, which is crucial for understanding how biotechnological solutions can replace or enhance ecosystem services. the focus on high-resolution geo-data and gis technologies for mapping and assessing ecosystem service demand aligns well with biotechnological ecosystem service replacement research. additionally, the study's findings on the potential capacity of gi line-side vegetation to provide ecosystem services further support its relevance to the field."
