Index,Article Title,Authors,Publication Year,Answer,Analysis
1,Linking soils to ecosystem services - A global review,Adhikari et al.,2016,yes,"the abstract discusses the relationship between soil and ecosystem services (es), highlighting the importance of soil in ecosystem functioning and the need for further research in this area. it emphasizes the role of soil in provisioning and regulating services, while also noting the limited studies on cultural and supporting services. the suggestion for future research to explore soil functional diversity and its spatial aspects aligns well with biotechnological ecosystem service replacement research, as it indicates a focus on understanding and potentially enhancing soil contributions to ecosystem services. this makes the article relevant for those interested in the intersection of biotechnology and ecosystem services."
2,Soil and the intensification of agriculture for global food security,Kopittke et al.,2019,yes,"the abstract emphasizes the critical role of soils in supporting numerous ecosystem services and highlights the negative impacts of agricultural intensification on soil health. it calls for a broader understanding of the interconnections between water, soil, food, and energy, suggesting that biotechnology could play a role in mitigating soil degradation. the focus on economic frameworks and decision-making processes indicates a potential intersection with biotechnological approaches aimed at sustainable soil management and ecosystem service replacement."
3,Integrated crop-livestock systems: Strategies to achieve synergy between agricultural production and environmental quality,Lemaire et al.,2014,yes,"the abstract discusses the integration of cropping and livestock systems to enhance agricultural diversity, which is crucial for improving ecosystem services while addressing food security. it emphasizes the importance of spatial and temporal interactions in agricultural systems and suggests that modern integrated crop-livestock systems can mitigate environmental impacts and enhance ecosystem services. this aligns well with biotechnological ecosystem service replacement research, as it explores innovative agricultural practices that leverage biodiversity and ecosystem functions to achieve sustainability."
4,"Successes and limitations of phytotechnologies at field scale: outcomes, assessment and outlook from COST Action 859",Mench et al.,2010,yes,"the abstract discusses the urgent need for remediation of polluted agricultural and brownfield soils, highlighting the potential of phytotechnologies as a cost-effective solution. it emphasizes the importance of integrating multidisciplinary research and stakeholder partnerships to ensure the long-term sustainability of these technologies. the focus on ecosystem services, such as biomass for energy and biodiversity, aligns well with biotechnological ecosystem service replacement research, making this article suitable for that field."
5,Protecting and restoring Europe's waters: An analysis of the future development needs of the Water Framework Directive,Carvalho et al.,2019,yes,"the abstract discusses the water framework directive (wfd), which aims to protect aquatic ecosystems and promote sustainable water use. it highlights the need for improved monitoring and assessment systems, which could be relevant for biotechnological ecosystem service replacement research. the focus on integrating water policy with other sectors and the potential for innovative diagnostic tools suggests that the findings could inform strategies for enhancing ecosystem services through biotechnological approaches."
6,Terrestrial carbon cycle affected by non-uniform climate warming,Xia et al.,2014,yes,"the abstract discusses the interactions between the terrestrial carbon cycle and climate change, highlighting how varying rates of warming affect ecosystem functions and services such as carbon sequestration and food production. this aligns well with biotechnological ecosystem service replacement research, as understanding these dynamics is crucial for developing strategies to mitigate climate impacts and enhance ecosystem services. the focus on regional variations in ecosystem productivity and the implications for carbon cycling further supports its relevance to the field."
7,Ten ways remote sensing can contribute to conservation,Rose et al.,2015,yes,"the abstract discusses the use of earth observation technologies to enhance conservation efforts, which directly relates to the assessment and replacement of ecosystem services. it identifies key questions that explore how remote sensing can improve understanding and management of ecosystems and their services. this aligns well with biotechnological ecosystem service replacement research, as it emphasizes innovative approaches to monitoring and valuing ecosystem services through technology."
8,Efficient Water Use in Residential Urban Landscapes,Hilaire et al.,2008,yes,"the abstract addresses critical issues related to water use in urban landscapes, emphasizing the need for efficient irrigation practices to conserve water, which is particularly relevant in the context of biotechnological ecosystem service replacement. it discusses the interplay between landscape management and ecosystem services, such as carbon regulation and climate control, suggesting potential avenues for biotechnological interventions to enhance water efficiency and maintain ecological balance."
9,"Linking land use change, ecosystem services and human well-being: A case study of the Manas River Basin of Xinjiang, China",Wang et al.,2017,yes,"the abstract discusses the significant relationship between land-use and land-cover change (lucc), ecosystem services, and human well-being, which is highly relevant to biotechnological ecosystem service replacement research. it highlights the use of advanced technologies (gis, rs, gps) to analyze these relationships, indicating a methodological approach that could be beneficial for understanding and potentially replacing ecosystem services affected by lucc. the findings emphasize the need for sustainable development and the balance between economic growth and ecological stability, which aligns with the goals of ecosystem service replacement research."
10,Reconciling productivity with protection of the environment: Is temperate agroforestry the answer?,Smith et al.,2013,yes,"the abstract discusses agroforestry as a multifunctional land-use system that integrates trees and shrubs with crops and livestock, highlighting its potential to provide both commodity and non-commodity outputs. it emphasizes the role of agroforestry in enhancing ecosystem services, such as biodiversity protection and climate resilience, making it relevant for research on biotechnological ecosystem service replacement. the focus on sustainable alternatives to industrial agriculture aligns well with the goals of enhancing ecosystem services through biotechnological innovations."
11,Opportunities to reduce the vulnerability of dryland farmers in Central and West Asia and North Africa to climate change,Thomas et al.,2008,yes,"the abstract discusses the impacts of climate change on drylands, particularly focusing on water scarcity and the need for adaptive strategies in agricultural practices. it emphasizes the importance of ecosystem services provided by rangelands and suggests potential management strategies, including the development of drought-resistant crops and improved irrigation practices. this aligns well with biotechnological ecosystem service replacement research, as it explores innovative agricultural adaptations and the role of technology in enhancing ecosystem resilience in the face of climate change."
13,Environmental sustainability of Alpine livestock farms,Battaglini et al.,2014,yes,"the abstract discusses the environmental impact of livestock systems, particularly in the italian alps, and emphasizes the importance of assessing ecosystem services provided by these systems. it highlights the relationship between animal husbandry, environmental sustainability, and socio-economic factors, which are crucial for biotechnological ecosystem service replacement research. the focus on greenhouse gas emissions and carbon sequestration further aligns with current research interests in sustainable practices within biotechnology."
14,"Assessment on forest carbon sequestration in the Three-North Shelterbelt Program region, China",Chu et al.,2019,yes,"the abstract discusses the assessment of carbon sequestration in forest ecosystems, specifically within the context of china's three-north shelterbelt program. it highlights the importance of understanding and quantifying ecosystem services, particularly climate regulation through carbon sequestration. the findings indicate a decreasing trend in carbon sequestration, which is relevant for discussions on ecosystem service replacement, especially in biotechnological contexts aiming to enhance or restore such services. therefore, it aligns well with research focused on biotechnological approaches to ecosystem service replacement."
16,Digital mapping of peatlands - A critical review,Minasny et al.,2019,yes,"the abstract discusses the importance of peatlands in providing ecosystem services such as carbon storage and climate regulation, which are critical in the context of climate change and land use changes. it emphasizes the need for accurate mapping of peatlands to understand their extent and carbon stocks, which is essential for conservation efforts. the focus on digital mapping techniques and the integration of various data sources aligns well with biotechnological approaches to ecosystem service replacement research, making this article suitable for that field."
17,"Large-scale, long-term trends in British river macroinvertebrates",Vaughan et al.,2012,yes,"the abstract discusses the evaluation of river macroinvertebrate fauna in relation to water quality and habitat changes, highlighting the positive biological recovery of rivers in england and wales due to improved water quality and restoration efforts. this aligns well with biotechnological ecosystem service replacement research, as it emphasizes the resilience of freshwater communities and the benefits of biodiversity from restoration investments aimed at enhancing ecosystem services like drinking water quality. the findings suggest that long-term monitoring and restoration can significantly impact ecosystem health, which is crucial for understanding and implementing biotechnological solutions in ecosystem service management."
18,"Assessment of ecosystem services in homegarden systems in Indonesia, Sri Lanka, and Vietnam",Mohri et al.,2013,yes,"the abstract discusses the ecological, social, and economic benefits of homegardens, emphasizing their role in providing various ecosystem services. it highlights the need for comprehensive research on these systems, particularly in the context of socio-economic changes and climate resilience. this focus aligns well with biotechnological ecosystem service replacement research, as it explores how traditional practices can be integrated with modern technology to enhance ecosystem services and sustainability."
20,Time for a shift in crop production: embracing complexity through diversity at all levels,Ostergard et al.,2009,yes,"the abstract discusses a comprehensive approach to crop production that emphasizes the importance of biodiversity and sustainable practices, which aligns well with biotechnological ecosystem service replacement research. it highlights the need for interdisciplinary collaboration to address challenges such as soil degradation and climate change, and it mentions specific tools like enhancing biological diversity and recycling nutrients. these elements are crucial for understanding how biotechnology can contribute to sustainable agricultural practices and ecosystem services."
21,Delivering multiple ecosystem services from Enclosed Farmland in the UK,Firbank et al.,2013,yes,"the abstract discusses the delivery of ecosystem services from enclosed farmland in the uk, emphasizing the integration of food production with other ecosystem services. it highlights the need for improved understanding of ecosystem service generation, economics, and governance, which are crucial for biotechnological approaches to ecosystem service replacement. the mention of minimizing environmental impacts through technology aligns well with biotechnological research in this field."
22,Tillage effects on carbon footprint and ecosystem services of climate regulation in a winter wheat-summer maize cropping system of the North China Plain,Zhang et al.,2016,yes,"the abstract discusses the impact of different tillage practices on greenhouse gas emissions, carbon footprints, and ecosystem service values related to climate regulation. it identifies no-till as a beneficial practice that enhances ecosystem services and reduces carbon footprints, which aligns with biotechnological ecosystem service replacement research. the focus on sustainable agricultural practices and their effect on climate change and ecosystem services makes it suitable for that field of study."
23,Assessment of multiple ecosystem services in New Zealand at the catchment scale,Ausseil et al.,2013,yes,"the abstract discusses the development of spatially explicit models for assessing various ecosystem services, which is directly relevant to biotechnological ecosystem service replacement research. it emphasizes the importance of these services in resource management and sustainability, particularly in the context of land-use scenarios like afforestation. the focus on indicators such as soil erosion control and carbon sequestration aligns well with the goals of understanding and potentially replacing ecosystem services through biotechnological means."
24,Effects of Land Use Changes on the Ecosystem Service Values of a Reclamation Farm in Northeast China,Hao et al.,2012,yes,"the abstract discusses the impact of intensive agricultural development on ecosystem services in northeast china, focusing on land use changes over time. it highlights the importance of evaluating ecosystem services to provide a scientific basis for sustainable agricultural practices and environmental management. the use of gis-rs technology to analyze variations in ecosystem service value adds a valuable methodological perspective. the findings emphasize the need for conservation efforts for wetlands and water areas, which are identified as having high service values. overall, this research aligns well with the themes of biotechnological ecosystem service replacement, as it addresses the balance between agricultural development and ecosystem health."
25,Drivers of decoupling and recoupling of crop and livestock systems at farm and territorial scales,Garrett et al.,2020,yes,"the abstract discusses the decoupling of crop and livestock production and its implications for sustainability, which aligns well with biotechnological ecosystem service replacement research. it emphasizes the need for integrated systems to address environmental challenges and suggests that redesigning research programs and policies could foster such integration. this focus on sustainable practices and ecosystem services makes it relevant to the field of biotechnology in agriculture."
26,Key ecosystem services and ecological intensification of agriculture in the tropical high-Andean Puna as affected by land-use and climate changes,Rolando et al.,2017,yes,"the abstract discusses the impact of agricultural practices on ecosystem services in high-altitude ecosystems, particularly in the high-andean puna. it highlights the importance of biodiversity, water provision, and soil organic carbon stocks, which are crucial for ecosystem sustainability. the review also proposes various technologies and practices aimed at preserving or restoring these ecosystem services, aligning well with the theme of biotechnological ecosystem service replacement research. the focus on ecological intensification and sustainable agricultural practices indicates a strong relevance to the field."
27,Aggregated indicator to assess land use impacts in life cycle assessment (LCA) based on the economic value of ecosystem services,Cao et al.,2015,yes,"the abstract discusses the development of a new life cycle impact assessment (lcia) methodology that incorporates additional indicators for evaluating land use impacts on ecosystem services, which is directly relevant to biotechnological ecosystem service replacement research. it emphasizes the importance of assessing terrestrial biodiversity loss and the economic valuation of ecosystem services, which aligns with the goals of understanding and replacing ecosystem services in biotechnological contexts. the case study on bio-based polymers further illustrates practical applications of this research, making it suitable for the field."
28,Governing agriculture-forest landscapes to achieve climate change mitigation,Agrawal et al.,2014,yes,"the abstract discusses interventions aimed at improving forest conditions and reducing deforestation, which are directly related to ecosystem services, particularly carbon storage in agriculture-forest landscapes. it emphasizes the importance of understanding the effectiveness of these interventions, which is crucial for biotechnological ecosystem service replacement research. the focus on rights, incentives, and technologies also aligns with the goals of enhancing ecosystem services through biotechnological means."
29,Multiple ecosystem services provision and biomass logistics management in bioenergy buffers: A state-of-the-art review,Ferrarini et al.,2017,yes,"the abstract discusses the evaluation of bioenergy buffers and their impact on multiple ecosystem services, which aligns well with biotechnological ecosystem service replacement research. it highlights the benefits of implementing bioenergy buffers on croplands, their effectiveness in providing ecosystem services like climate regulation and soil health, and the economic implications of such practices. the focus on biomass supply chains and the identification of knowledge gaps also suggest a comprehensive approach relevant to the field."
30,Metabolomics: an emerging frontier of systems biology in marine macrophytes,Kumar et al.,2016,yes,"the abstract discusses the application of metabolomics to marine macrophytes, which are essential for ecosystem services. it highlights the threats these organisms face and the importance of understanding their biochemical responses to environmental stressors. the focus on analytical tools, chemical defenses, and the integration of various omics disciplines indicates a comprehensive approach that is relevant for research into biotechnological ecosystem service replacement. this suggests that the findings could contribute valuable insights into enhancing or replacing ecosystem services provided by marine macrophytes."
31,"Taking a second look: climate change, periodic relicensing and improved management of dams",Pittock et al.,2011,yes,"the abstract discusses the impact of dams on freshwater ecosystems and highlights the need for reassessment and potential modification or removal of aging and unsafe dams. it emphasizes the importance of maximizing environmental, social, and economic benefits through improved management practices and regulatory systems. this aligns well with biotechnological ecosystem service replacement research, as it addresses the restoration and enhancement of ecosystem services affected by human infrastructure."
32,"Review: Domestic herbivores and food security: current contribution, trends and challenges for a sustainable development",Mottet et al.,2018,yes,"the abstract discusses the role of domestic herbivores in various ecosystems, highlighting their contributions to food security, economic development, and environmental sustainability. it emphasizes the importance of sustainable practices in herbivore production, which aligns with the goals of biotechnological ecosystem service replacement research. the mention of genetic diversity, climate change mitigation, and the circular bioeconomy further supports its relevance to the field."
33,Characteristics of bioeconomy systems and sustainability issues at the territorial scale. A review,Wohlfahrt et al.,2019,yes,"the abstract discusses the complexity of bioeconomy systems and emphasizes the need for sustainable development frameworks, which aligns well with research on biotechnological ecosystem service replacement. it highlights the interactions among various stakeholders, the importance of circularity in resource use, and the influence of external factors like policies and market dynamics. these elements are crucial for understanding how biotechnology can contribute to ecosystem services and sustainability in bioeconomy contexts."
34,Unravelling the interrelationships between ecosystem services and human wellbeing in the Bangladesh delta,Hossain et al.,2017,yes,"the abstract discusses the dynamic relationships between ecosystem services (es) and human well-being (hwb) in a specific region, which is highly relevant to biotechnological ecosystem service replacement research. it emphasizes the importance of understanding these interactions for sustainable ecosystem management and highlights the implications of declining ecosystem services on human well-being. the use of statistical models to analyze these relationships and the mention of resilience in social-ecological systems further support its suitability for research in this field."
35,Reducing risks by transforming landscapes: Cross-scale effects of land-use changes on ecosystem services,Fedele et al.,2018,yes,"the abstract discusses the impacts of land-use changes on ecosystem services, particularly in rural communities in indonesia. it highlights how these changes affect the supply of ecosystem services that are crucial for livelihoods and well-being. the focus on adaptation strategies and their broader implications aligns well with biotechnological ecosystem service replacement research, as it emphasizes the need for understanding trade-offs among ecosystem services and the potential for scaling up land management policies. this relevance to ecosystem services and adaptation strategies makes it suitable for the research area in question."
36,Spatial patterns and environmental constraints on ecosystem services at a catchment scale,Emmett et al.,2016,yes,"the abstract discusses the evaluation of ecosystem service supply metrics, including water quality regulation and carbon storage, which are relevant to biotechnological ecosystem service replacement research. it emphasizes the importance of understanding environmental controls and the interplay between various ecosystem services, aligning well with the goals of biotechnological approaches to enhance or replace these services. the use of models and integration of diverse datasets also supports the applicability of the findings to biotechnological innovations in ecosystem management."
40,Greater stability of carbon capture in species-rich natural forests compared to species-poor plantations,Osuri et al.,2020,yes,"the abstract discusses the comparative analysis of carbon sequestration between species-rich natural forests and monodominant plantations, which is highly relevant to biotechnological ecosystem service replacement research. it highlights the importance of biodiversity in enhancing carbon capture stability and resilience to climate change, suggesting that promoting natural forest regeneration and multi-species plantations could provide significant benefits for climate change mitigation and biodiversity conservation. this aligns well with the goals of ecosystem service replacement research, making the article suitable for that field."
41,Climate regulation by free water surface constructed wetlands for wastewater treatment and created riverine wetlands,Mander et al.,2014,yes,"the abstract discusses the role of constructed wetlands (cws) and created riverine wetlands (crws) in wastewater treatment and climate regulation, focusing on greenhouse gas emissions. it presents a meta-analysis of existing studies, highlighting relationships between emissions and various biophysical factors. the findings suggest that design and management of these ecosystems can influence their greenhouse gas emissions, which is relevant for biotechnological approaches to ecosystem service replacement. the emphasis on improving design and management practices aligns well with the goals of biotechnology in enhancing ecosystem services."
42,Assessing the environmental impacts of high-altitude agriculture in Taiwan: A Driver-Pressure-State-Impact-Response (DPSIR) framework and spatial emergy synthesis,Lin et al.,2013,yes,"the abstract discusses the integration of emergy evaluation and gis to investigate the environmental impacts of changing agricultural practices in taiwan, particularly in high-altitude areas. it highlights significant changes in agricultural land use and the resulting decline in ecosystem services, which are directly relevant to biotechnological ecosystem service replacement research. the findings on the sustainability of ecosystem services and the negative impacts of high-altitude agriculture provide valuable insights that could inform biotechnological approaches aimed at restoring or replacing these services."
